{
  "$schema": "https://json-schema.org/draft/2020-12/schema",
  "$id": "https://bamboo.dev/schemas/plugin/tool-event-v1.schema.json",
  "title": "ToolEventV1",
  "type": "object",
  "x-bamboo-maxJsonBytes": 16384,
  "required": ["schema_version", "event_type", "subscription_id", "context", "data"],
  "properties": {
    "schema_version": { "const": 1 },
    "event_type": { "type": "string", "minLength": 1, "x-bamboo-maxUtf8Bytes": 128 },
    "subscription_id": { "type": "string", "minLength": 1, "x-bamboo-maxUtf8Bytes": 128 },
    "context": {
      "type": "object",
      "required": ["session_id", "root_session_id", "tool_call_id"],
      "properties": {
        "session_id": { "type": "string", "minLength": 1, "x-bamboo-maxUtf8Bytes": 256 },
        "root_session_id": { "type": "string", "minLength": 1, "x-bamboo-maxUtf8Bytes": 256 },
        "tool_name": { "type": "string", "minLength": 1, "x-bamboo-maxUtf8Bytes": 128 },
        "tool_call_id": { "type": "string", "minLength": 1, "x-bamboo-maxUtf8Bytes": 256 }
      },
      "additionalProperties": true
    },
    "data": { "type": "object" },
    "observation_policy_generation": { "type": "integer", "minimum": 1 }
  },
  "allOf": [
    {
      "if": {
        "properties": {
          "event_type": { "const": "file_changed" }
        },
        "required": ["event_type"]
      },
      "then": {
        "properties": {
          "subscription_id": { "const": "tool.file_changed.v1" },
          "data": {
            "type": "object",
            "properties": {
              "path": { "type": "string", "minLength": 1, "x-bamboo-maxUtf8Bytes": 4096 },
              "path_redaction_reason": {
                "type": "string",
                "enum": ["permission_not_granted", "sensitive_path", "unsafe_path"]
              },
              "diff": { "type": "string", "x-bamboo-maxUtf8Bytes": 4096 },
              "diff_truncated": { "type": "boolean" },
              "content": { "type": "string", "x-bamboo-maxUtf8Bytes": 8192 },
              "content_truncated": { "type": "boolean" }
            },
            "oneOf": [
              {
                "required": ["path"],
                "not": { "required": ["path_redaction_reason"] }
              },
              {
                "required": ["path_redaction_reason"],
                "not": { "required": ["path"] }
              }
            ],
            "allOf": [
              {
                "if": {
                  "anyOf": [
                    { "required": ["diff"] },
                    { "required": ["diff_truncated"] },
                    { "required": ["content"] },
                    { "required": ["content_truncated"] }
                  ]
                },
                "then": { "required": ["path"] }
              },
              {
                "if": { "required": ["diff_truncated"] },
                "then": { "required": ["diff"] }
              },
              {
                "if": { "required": ["content_truncated"] },
                "then": { "required": ["content"] }
              }
            ],
            "additionalProperties": true
          }
        }
      }
    },
    {
      "if": {
        "properties": {
          "subscription_id": { "const": "tool.file_changed.v1" }
        },
        "required": ["subscription_id"]
      },
      "then": {
        "properties": {
          "event_type": { "const": "file_changed" }
        }
      }
    }
  ],
  "additionalProperties": true
}
